Uuid,Role name,Description,Inherited roles,Privileges,_order:1000
c5bb4870-52f8-4eb3-9e99-ca07db74e3c4,Register patients,Person able to register patients and add vitals,,Get Visit Types;Get Concept Classes;View Observations;Add Visits;Get Visit Attribute Types;Add Patients;Edit Patient Identifiers;Get Visits;Get Providers;Patient Dashboard - View Encounters Section;Edit Encounters;Add Observations;View Patient Identifiers;Edit Visits;Get Encounters;View Encounters;Get People;Get Encounter Types;Get Person Attribute Types;Configure Visits;Get Patients;Get Patient Identifiers;Add Encounters;Patient Dashboard - View Patient Summary;View Patients;Edit Observations;Get Concepts;Edit Patients;Edit People;View Person Attribute Types,
94478d6a-382e-48d9-8e06-835843ff511d,Print Patient Label Sticker,The person responsible for printing patient label stickers,,App: Can View Patient Identifier Sticker Report;App: Can View Patient Identity Stiker Report,
e809e519-353d-40c9-8644-f215a6cf854f,Help Nurse,Person able to help nurses with their tasks,Register patients;Print Patient Label Sticker,,
d74b1a29-6f80-49af-ab33-59e55382b20d,Inpatient Consultant,A doctor managing the Inpatient consultation form,,View Inpatient Consultation;Edit Inpatient Consultation,
87fb9f64-d274-4acc-a467-11a5608be50c,Outpatient Consultant,A doctor managing the Outpatient consultation form,,View Outpatient Consultation;Edit Outpatient Consultation,
fb816163-c20c-4a91-83d7-139727763d3b,Nurse,A nurse who can help with patient care,Register patients,Get Care Settings;Get Order Types;Get Conditions;View Orders;App: attachments.attachments.page;Manage Immunization Summary;View Appointment Services;Manage Own Appointments;Get Orders;Manage Appointment Services;Patient Overview - View Allergies;Get Order Set Attribute Types;Appointments: Invite Providers;Get Medication Dispense;Get Observations;Get Allergies;Get Order Sets;Get Order Frequencies;View Allergies;View Attachments;Manage Appointments;Patient Dashboard - View Conditions;View Appointments;Reset Appointment Status;View Inpatient Consultation;View Outpatient Consultation,
